processSpecificationPost; SharedDriveConnector.java; connectors.jcifs.connector.src.main.java.org.apache.manifoldcf.crawler.connectors.sharedrive; ConfigParams.java;60; processSpecificationPost; RSSConnector.java; connectors.rss.connector.src.main.java.org.apache.manifoldcf.crawler.connectors.rss; ConfigParams.java;56; processConfigurationPost; MeridioAuthority.java; connectors.meridio.connector.src.main.java.org.apache.manifoldcf.crawler.connectors.meridio; ConfigParams.java;49; processConfigurationPost; SolrConnector.java; connectors.solr.connector.src.main.java.org.apache.manifoldcf.agents.output.solr; ConfigParams.java;49; processConfigurationPost; WebcrawlerConnector.java; connectors.webcrawler.connector.src.main.java.org.apache.manifoldcf.crawler.connectors.webcrawler; ConfigurationNode.java;46; processConfigurationPost; MeridioConnector.java; connectors.meridio.connector.src.main.java.org.apache.manifoldcf.crawler.connectors.meridio; ConfigParams.java;45; 