"a4fdb1f70d",3,3,"B",3,3,3,"A",5,240,32,8,323.97,1,240,2,"Mayabe to create utility classes to reduce the different responsibilities of the DirectoryScanner class and reduce the complexity.","Possibility create utility class with methods not use class instance variable (it's possible view by decision tree)."
"a4fdb1f70d",3,3,"B",3,3,3,"A",5,241,32,5,630.21,1,241,-1,"1. The class NOT redefining most of the inherited methods\
2. Not used methods and data from parents because in this case is one extension","This metric of number of physical lines is affected by lines with \"{\" in another line"
"a4fdb1f70d",3,3,"B",3,3,3,"A",5,242,32,6,245.56,1,242,2,"The number of lines is affected by lines with \"{\". It's possible extract methods from \"check\".","The choose by shown decision tree is based only number of lines, this is bad."
"a4fdb1f70d",3,3,"B",3,3,3,"A",5,243,32,12,212.07,1,243,2,"It's possible reduce to one the number of params, creating a class with configuration data.","Why not the number of parameters?"
"a4fdb1f70d",3,3,"B",3,3,3,"A",5,244,32,16,133.16,1,244,-2,"Does not fit either item.","Did not help"
"a4fdb1f70d",3,3,"B",3,3,3,"A",5,245,32,15,124.88,1,245,-2,"In shown code not have methods with long params list.","Did not help. Why not the number of parameters?"
"a4d316213a",0,0,"M",1,2,2,"A",1,246,36,4,81.5,0,246,2,"Method seems to be very long!",""
"a4d316213a",0,0,"M",1,2,2,"A",1,247,36,14,39.86,0,247,-2,"Very small",""
"a4d316213a",0,0,"M",1,2,2,"A",1,248,36,7,94.84,0,248,-1,"It does not seem redefining inherited methods",""
"a4d316213a",0,0,"M",1,2,2,"A",1,249,36,3,78.55,0,249,1,"Seems to be very long, maybe god class, but I'm not sure",""
"a4d316213a",0,0,"M",1,2,2,"A",1,250,36,11,16.59,0,250,2,"Too many parameters",""
"a4d316213a",0,0,"M",1,2,2,"A",1,251,36,13,17.23,0,251,-1,"Too short to be god class",""
"a4d316213a",0,0,"M",1,2,2,"A",1,252,36,12,156.82,1,252,-1,"not too many parameters","helped"
"a4d316213a",0,0,"M",1,2,2,"A",1,253,36,6,35.65,1,253,2,"too long","helped to see lines"
"a4d316213a",0,0,"M",1,2,2,"A",1,254,36,16,46.02,1,254,-1,"too short","I do not have experience with cohesion"
"a4d316213a",0,0,"M",1,2,2,"A",1,255,36,5,78.03,1,255,1,"Depth of Inheritance","Helped to see depth of Inheritance"
"a4d316213a",0,0,"M",1,2,2,"A",1,256,36,8,46.51,1,256,1,"too long","I do not have experience with cohesion"
"a4d316213a",0,0,"M",1,2,2,"A",1,257,36,15,31.02,1,257,-1,"do not see may parameters","did not help too much"
"3e86e694d5",3,3,"M",4,4,4,"B",15,260,41,4,482.82,1,260,2,"too many line codes; lots of code descision structures and calls that can be refatctored to smaller methods","made the decision more objective (saves time)"
"3e86e694d5",3,3,"M",4,4,4,"B",15,264,41,7,1487.71,1,264,-1,"classes seem to be in thesame project, maybe they have wrong hierarchy but \
\
1 - all methods on parent class are gets and sets and many are used in subclass\
2 - by just looking to these two classes it is not possible to infer if other classes are just using the parent methods (parent class is not abstract)\
3 - by just looking to these two classes it is not possible to infer if other children classes are not using the parent methods","the rule in decision tree seems too simple (maybe result in a false positive in an automated tool) but it was useful to review the design of two classes that eventually were not going to be reviewed at all (or at least not reviewed with full attention)"
"3e86e694d5",3,3,"M",4,4,4,"B",15,269,41,14,538.88,1,269,-2,"method seems simple","none, the decision tree evaluated to wrong node?"
"3e86e694d5",3,3,"M",4,4,4,"B",15,271,41,3,413.39,1,271,2,"too many lines in class; could use child classes or use utility classes","made the analysis easier; the rule was objective"
"3e86e694d5",3,3,"M",4,4,4,"B",15,274,41,13,98.69,1,274,-2,"not seems a god class, too small","do not seem applicable"
"3e86e694d5",3,3,"M",4,4,4,"B",15,277,41,11,1185.9,1,277,1,"not possible to conclude long param list just looking the number of parameters (7 seems the maximum recommended)","the comment code ratio rule changed my initial perception and pojnted that maybe the param list is really too long and (the params use) not well documented"
"3e86e694d5",3,3,"M",4,4,4,"B",15,278,41,12,192.97,0,278,-1,"7 seems the maximum allowed; also 3 of them are already classes/objects (not native types) which may indicate that the initial long param list was already refactored (passing the objects instead of their attributes in order to reduce param list)",""
"3e86e694d5",3,3,"M",4,4,4,"B",15,279,41,8,164,0,279,2,"extremely long class; maybe it could be refactored into smaller utility classes (or use some smaller ones)",""
"3e86e694d5",3,3,"M",4,4,4,"B",15,280,41,16,40.64,0,280,-2,"looks a simple class",""
"3e86e694d5",3,3,"M",4,4,4,"B",15,281,41,15,29.18,0,281,-2,"no params",""
"3e86e694d5",3,3,"M",4,4,4,"B",15,282,41,6,109.12,0,282,2,"the method could be refactored into smaller ones; many TODOs may indicate that the method size will increase and it will get harder to read",""
"3e86e694d5",3,3,"M",4,4,4,"B",15,283,41,5,1008.79,0,283,-1,"the children does not seem to be redefining but using as stream (casting to StreamMessage) a declared parent property (message); but most of logging code could be in parent like this (it would reduce the number of lines of both parent and child)\
\
// declared in parent class\
protected void trace(final String methodName, final String name, final short value) {\
	if (_log.isTraceEnabled())\
	{\
		_log.trace(methodName + \"(\" + name != null ? (name + \", \"):\"\" + value + \")\");\
	}\
}\
\
// declared in parent or child\
private void trace(final String methodName, final short value) {\
	trace(methodName, null, value);\
}",""
"396e223081",3,3,"M",4,2,3,"I",8,261,42,4,57.62,0,261,2,"This is doing far too much. This should be broken down into smaller functions that each can be tested and verified.",""
"396e223081",3,3,"M",4,2,3,"I",8,262,42,7,246.96,0,262,-2,"This class only overrides one method (toString), so it's not that problem. This is saying that it's bad to extend a class but then not use most of its base class internals, and I disagree with that. This class specifically looks like it's a true extension of the base class, and just trusts the uses for the base class to do its job without interfering.",""
"396e223081",3,3,"M",4,2,3,"I",8,263,42,14,122.48,0,263,-2,"It's definitely not too long. It _might_ be doing too much, but at the end of the day, this is pretty clean to me: It initializes the script runner, executes a particular script, and then returns the evaluated value.",""
"396e223081",3,3,"M",4,2,3,"I",8,265,42,3,186.54,0,265,-1,"I do think that this class could be broken into a few different classes, or at least have some of the configuration be done in separate classes, but at the end of the day this class does just have one, singular responsibility (to search a directory), so it can hardly be called a god class.",""
"396e223081",3,3,"M",4,2,3,"I",8,266,42,13,104.86,0,266,-2,"I don't understand the analysis here at all, honestly; this is a very specific class doing a specific thing, with one instance variable and three methods. It's possible the parent class is massive and is a god class, but I can't see that here.",""
"396e223081",3,3,"M",4,2,3,"I",8,267,42,11,64.69,0,267,2,"Long parameter lists can always be avoided with encapsulation at worst or something like a builder if necessary. This is no exception.",""
"396e223081",3,3,"M",4,2,3,"I",8,268,42,12,141.7,1,268,2,"I believe most of these parameters could be encapsulated in a configuration object.","I disagree with the path here, heavily. I think that a low number of declarative statements is not inherently smelly. I also believe that 8 is far too high of a number to be smelly."
"396e223081",3,3,"M",4,2,3,"I",8,270,42,8,329.57,1,270,-1,"Similar to the previous god class example, I disagree that this is a god class. This is just a large class that needs refactoring.","The decision tree points to a lack of cohesion as the reason this is classified as a god class. I agree that a lack of cohesion can certainly be smelly, but this class is just an uncohesive mess, not really a god class; it still has one responsibility, it just does it poorly."
"396e223081",3,3,"M",4,2,3,"I",8,272,42,16,195.41,1,272,-2,"This doesn't make a lot of sense again. While there's definitely some smelliness here (why not use the `initializeParser` method in the ctor when it's literally the same code?), this is not a god class at all.","This must be calculating this class having low cohesion based on its base class, because 100% of this classes methods use 100% of its properties, if you don't count the base class."
"396e223081",3,3,"M",4,2,3,"I",8,273,42,15,96.37,1,273,-2,"There are literally no parameters in this method, how could it have a long parameter list?","I highly disagree on a comment-to-code ratio being smelly by itself, and especially if it's used in the long parameter list classification. Some of the best code I've ever worked in had no comments, and some of the worst code I've ever worked in was commented like crazy (the comments were just out of date)."
"396e223081",3,3,"M",4,2,3,"I",8,275,42,6,545.18,1,275,1,"I agree that this method is too long, and particular this method has a high degree of cyclomatic complexity (something that the decision tree does think about, but didn't get to in this case). It's doing too much.","I think there are some valid scenarios for long methods that aren't necessarily smelly, although they're fewer and further between. I think this was a pretty accurate line to follow, even if I don't necessarily agree with some of the other paths (comment to code ratio)"
"396e223081",3,3,"M",4,2,3,"I",8,276,42,5,515.91,1,276,-2,"This seems like a valid use case for inheritance to me. I like the rule of \"is a\" vs \"has a\". QpidRAStreamMessage IS a QpidRAMessage, and QpidRAMessage IS a message.","While I personally prefer composition over inheritance, there are valid use cases for inheritance; this seems like a valid one. I disagree in labeling all inheritance chains as smelly."
"9247fa543f",1,0,"N",2,0,2,"A",1,287,49,3,449.31,0,287,2,"Por mais que centralizar as funcionalidades de um sistema pareça, muitas vezes, ser uma boa solução pra facilitar a manutenção, não é bem assim. Ao fazer isso, o código passa a ficar muito maior, mais suscetível a bugs e tende a ter uma difícil compreensão por parte de terceiros. Sendo assim, centralizar muitas funções com diferentes responsabilidades é uma má prática.",""
"9247fa543f",1,0,"N",2,0,2,"A",1,291,49,14,358.8,0,291,2,"Um método que deveria apenas retornar verdadeiro ou falso executar outras chamadas dentro dele não é uma prática interessante.",""
"9247fa543f",1,0,"N",2,0,2,"A",1,294,49,4,250.34,0,294,2,"O código exibido possui muitos indícios de um bad smell: muitas variáveis temporárias, muitas estruturas de decisão encadeadas, responsabilidades diferentes dentro do mesmo método (search, get)",""
"9247fa543f",1,0,"N",2,0,2,"A",1,300,49,11,564.83,0,300,2,"Não existe uma regra específica para determinar quantos parâmetros são considerados \"muitos\", mas uma chamada com 7 parâmetros possui vários problemas: \
É difícil fazer a chamada do método e passar os parâmetros na ordem correta\
É difícil interpretar o que o método realmente faz (Clean Code)\
O método possui parâmetros booleanos",""
"9247fa543f",1,0,"N",2,0,2,"A",1,308,49,7,828.54,0,308,2,"No código em questão, a classe filho não utiliza nenhum método ou atributo da classe pai, portanto não há necessidade de herança.",""
"9247fa543f",1,0,"N",2,0,2,"A",1,313,49,13,161.81,0,313,-1,"A classe analisada possui apenas 3 métodos implementados com uma responsabilidade em comum: tratar valor.",""
"9247fa543f",1,0,"N",2,0,2,"A",1,358,49,8,1078.12,1,358,1,"A quantidade de linhas, mesmo não sendo um fator totalmente determinando para o smell de god class, mostra o quanto o código está ruim. Uma classe com 3200 linhas não é algo bom de se fazer (nem mesmo para o dono do código)","Nesse caso, o smell é tão escandaloso, que a árvore de decisão sugere uma forma ineficiente de verificar se é smell ou não: Percent Lack of Cohesion Methods"
"9247fa543f",1,0,"N",2,0,2,"A",1,387,49,15,694.89,1,387,-2,"Aparentemente, a classe não possui parâmetros.","A árvore não se adequou ao código em questão, pois direcionou para um caminho onde a justificativa foi linhas de declarative code > 3, mas o código analisado não possui nenhuma"
"9247fa543f",1,0,"N",2,0,2,"A",1,402,49,16,209.08,1,402,-2,"O código analisado não possui o smell god class, pois seus métodos têm responsabilidades em comum","A árvore de decisão se baseou na quantidade de linhas (num primeiro momento), para julgar o smell, mas o código só possui 66 linhas e a árvore julgou ter mais de 612"
"9247fa543f",1,0,"N",2,0,2,"A",1,424,49,12,478.68,1,424,2,"Além de ter muitos parâmetros, incluindo parâmetros booleanos, ao analisar o retorno da função, pode-se ver que a criação da função não era necessária.","Não há declarative statements no código analisado, algo que a árvore usou para decidir se é um smell ou não"
"9247fa543f",1,0,"N",2,0,2,"A",1,445,49,5,422.64,1,445,2,"A classe filha herda apenas 1 método da classe pai","A árvore tomou a decisão errada ao julgar a DIT < 2 = False, visto que, no caso analisado, a DIT = 1;"
"9247fa543f",1,0,"N",2,0,2,"A",1,468,49,6,403.12,1,468,2,"Apesar das responsabilidades serem semelhantes, o método está realizando muitas tarefas, com muitas estruturas de decisão encadeadas e variáveis recebendo null, além de muitas declarações de variáveis temporárias.","A árvore levou em consideração apenas a quantidade de linhas para definir o smell"
"5793c0e432",1,0,"B",2,1,1,"A",2,286,50,4,273.29,0,286,2,"Este método esta fazendo mais de uma coisa",""
"5793c0e432",1,0,"B",2,1,1,"A",2,289,50,14,214.17,0,289,2,"Comentários desnecessários",""
"5793c0e432",1,0,"B",2,1,1,"A",2,295,50,11,499.26,0,295,1,"O código apresenta linhas de códigos semelhantes",""
"5793c0e432",1,0,"B",2,1,1,"A",2,303,50,7,1036.91,0,303,2,"A classe filha herda todos os métodos da classe pai, porém muitos deles não estão sendo implementados.",""
"5793c0e432",1,0,"B",2,1,1,"A",2,311,50,3,376.56,0,311,2,"Existem muitas informações na classe. Onde a classe está assumindo mais de uma responsabilidade",""
"5793c0e432",1,0,"B",2,1,1,"A",2,312,50,13,44.99,0,312,-2,"A classe possui apenas uma responsabilidade",""
"5793c0e432",1,0,"B",2,1,1,"A",2,317,50,16,321.69,1,317,-2,"A classe assumi apenas uma responsabilidade","Neste caso, nem ajuda e nem atrapalha"
"5793c0e432",1,0,"B",2,1,1,"A",2,331,50,12,406.27,1,331,-2,"Pela seguindo a árvore de decisão, o código está totalmente correto","Ajudou bastante"
"5793c0e432",1,0,"B",2,1,1,"A",2,338,50,8,189.01,1,338,2,"Totalmente sem coerência esse alfabeto feito em 26 array","Ajudou bastante"
"5793c0e432",1,0,"B",2,1,1,"A",2,350,50,15,222.6,1,350,2,"Todos os métodos respeitam o número de parâmetros dado pela árvore de decisão","Ajudou bastante"
"5793c0e432",1,0,"B",2,1,1,"A",2,359,50,5,322.38,1,359,-2,"O código esta escrito de forma correta","Ajudou bastante"
"5793c0e432",1,0,"B",2,1,1,"A",2,375,50,6,507.04,1,375,-2,"O código esta correto","Ajudou bastante"
"daaa615ee5",2,2,"N",2,1,2,"A",0,296,51,4,982.15,1,296,2,"the method is too long, there's a few parts that could be split into other methods, also, the \"Try/Catch\" covers the entire method","Lines with source code"
"daaa615ee5",2,2,"N",2,1,2,"A",0,309,51,14,1332.94,1,309,-1,"although the method is composed only by 3 lines of code wich is composed by other methods we, don't know the complexity of those, it could be a long method but it doesn't seem to be","Lines with source code"
"daaa615ee5",2,2,"N",2,1,2,"A",0,318,51,11,450.54,1,318,2,"great part of the parameters are just giving its values to object's attributes,  those parameters should be replaced with the following object","Numbers of declarative lines of code and declative statements"
"daaa615ee5",2,2,"N",2,1,2,"A",0,346,51,7,754.04,1,346,2,"the child class is using only a few methods of the parent class and most of them are just get/set","number of pysical lines"
"daaa615ee5",2,2,"N",2,1,2,"A",0,372,51,3,775,1,372,2,"The class does everything just like a code made with structured programming","Lines with source code"
"daaa615ee5",2,2,"N",2,1,2,"A",0,378,51,13,113.74,1,378,-2,"It's a simple class with a few methods","nothing"
"daaa615ee5",2,2,"N",2,1,2,"A",0,388,51,16,157.65,0,388,-2,"the code is simple with a few methods",""
"daaa615ee5",2,2,"N",2,1,2,"A",0,395,51,12,111.94,0,395,2,"The method is useless, all the parameters are being returned it doesn't even make sense like WHY WOULD YOU DO THAT????",""
"daaa615ee5",2,2,"N",2,1,2,"A",0,404,51,8,166.53,0,404,2,"This is a giant class with too much responsibility to handle (some of them are ridiculous)",""
"daaa615ee5",2,2,"N",2,1,2,"A",0,407,51,15,84,0,407,-2,"It doesn't even have parameters",""
"daaa615ee5",2,2,"N",2,1,2,"A",0,427,51,5,328.04,0,427,2,"the child class uses just a few methods from the parent class",""
"daaa615ee5",2,2,"N",2,1,2,"A",0,430,51,6,62.17,0,430,-2,"all the data needed is included on the array list",""
"0ff9dc16b9",0,1,"N",2,1,1,"A",2,288,52,4,340.55,0,288,2,"146 lines for one method... Depending on the rest of the project, it might be better to extract more methods out of this single one.",""
"0ff9dc16b9",0,1,"N",2,1,1,"A",2,292,52,11,411.39,0,292,-1,"All parameters are being used normally along the method",""
"0ff9dc16b9",0,1,"N",2,1,1,"A",2,293,52,14,88.48,0,293,-2,"the comment spacing still annoying",""
"0ff9dc16b9",0,1,"N",2,1,1,"A",2,297,52,13,269.07,0,297,-1,"Simple class. \
get, set and a self-Exception methods.",""
"0ff9dc16b9",0,1,"N",2,1,1,"A",2,299,52,7,84.59,0,299,2,"could't find any calls for the Parent class with Ctrl-F",""
"0ff9dc16b9",0,1,"N",2,1,1,"A",2,301,52,3,359.2,0,301,2,"I counted 34 methods, some of them for different data manipulation (some for Strings, other for Files).\
Definitely possible to extract some classes from this one.",""
"0ff9dc16b9",0,1,"N",2,1,1,"A",2,304,52,12,369.13,1,304,-2,"it has > 3 statements, and every single of them are used.","The second layer of the Decision tree."
"0ff9dc16b9",0,1,"N",2,1,1,"A",2,310,52,5,289.24,1,310,-2,"overall it uses the parent class methods and data","DIT is fewer than 2"
"0ff9dc16b9",0,1,"N",2,1,1,"A",2,327,52,15,668.46,1,327,1,"useless comments in the code, to much declarations","following the glossary until the comments section"
"0ff9dc16b9",0,1,"N",2,1,1,"A",2,345,52,6,495.37,1,345,2,"huge \"if\" decisions recurrency, TODO comments","again, just following glossary definitions and intuition"
"0ff9dc16b9",0,1,"N",2,1,1,"A",2,353,52,16,146.2,1,353,-2,"The class is cohesive, from the comments it cleary looks like just parse and compile snippets.","the tree didn't helped much."
"0ff9dc16b9",0,1,"N",2,1,1,"A",2,361,52,8,359.93,1,361,-1,"huge class but quite well commented. I guess this is to be expected from a Scanner class...","couldn't quite understand the \"Percent Lack of Cohesion in Methods\" metric"
"60047cd9d5",1,0,"B",3,1,3,"A",3,290,53,4,608.64,1,290,2,"O código tem muitas condicionas e chama muitos outros métodos, além de invocar outros objetos, oque acaba deixando muita responsabilidade em cima do mesmo método","neste caso o numero de linhas não caracteriza um Bad Smell e sim a quantidade de tarefas atribuídas a ele, logo, neste caso, não foi de MUITA ajuda."
"60047cd9d5",1,0,"B",3,1,3,"A",3,298,53,11,659.39,1,298,1,"Sem dúvida este método tem um lista de parâmetros muito e extensa porém não acredito que, de acordo com o nível de responsabilidade dado a este método, teria como reduzir estes parâmetros","no número de Statements do código"
"60047cd9d5",1,0,"B",3,1,3,"A",3,302,53,14,613.82,1,302,-2,"O código contem poucas linhas e uma tarefa simples para este método, oque não caracteriza um Code Smell","Não ajudou"
"60047cd9d5",1,0,"B",3,1,3,"A",3,305,53,13,205.64,1,305,-2,"A pesar de ser um Code Smell, não se caracteriza pela quantidade de responsabilidades e sim pela quantidade de comentários de poluem o código, mais atrapalhando que ajudando","Não ajudou"
"60047cd9d5",1,0,"B",3,1,3,"A",3,314,53,7,363.67,1,314,-1,"Neste caso, a parcela de métodos sobrescritos na classe filho agem como uma interface","Não muito"
"60047cd9d5",1,0,"B",3,1,3,"A",3,319,53,3,263.16,1,319,1,"Além dos citados na descrição, a quantidade de comentários polui o código, atrapalhando na legibilidade","Pouco"
"60047cd9d5",1,0,"B",3,1,3,"A",3,322,53,12,138.83,0,322,2,"Um grande número de parâmetros, oque caracteriza uma responsabilidade muito grande dada ao método",""
"60047cd9d5",1,0,"B",3,1,3,"A",3,328,53,5,140.04,0,328,-2,"Ao meu ver, o código não apresenta Code Smell",""
"60047cd9d5",1,0,"B",3,1,3,"A",3,330,53,15,31.16,0,330,-2,"Não apresenta Code Smell",""
"60047cd9d5",1,0,"B",3,1,3,"A",3,334,53,6,112.21,0,334,2,"Método longo e com muitas responsabilidades",""
"60047cd9d5",1,0,"B",3,1,3,"A",3,336,53,16,69.64,0,336,1,"Uma lista de Parâmetros muito grande no método CodeSnippetCompiler",""
"60047cd9d5",1,0,"B",3,1,3,"A",3,339,53,8,70.77,0,339,-2,"Lista grande de responsabilidades para uma só classe",""
"037817b100",0,0,"N",2,1,2,"A",0,306,54,3,1965.59,1,306,-1,"Even though the code is extremely lengthy due to the several lines of comments, I haven't been able to find any class that concentrates many variables.","The amount of lines in the code."
"037817b100",0,0,"N",2,1,2,"A",0,316,54,11,397.24,1,316,2,"The list of parameters is very long and some of these parameters are used only once, possibiliting the creation of another separate function to use them.","All of the highlighted nodes helped."
"037817b100",0,0,"N",2,1,2,"A",0,324,54,13,306.49,1,324,-2,"This class is not complex or is centralizing the system at all.","The lack of methods cohesion. They are coherent and even used by each other."
"037817b100",0,0,"N",2,1,2,"A",0,342,54,7,529.82,1,342,2,"The child class uses almost none of the inherited methods.","The depth of inheritance tree."
"037817b100",0,0,"N",2,1,2,"A",0,354,54,14,281.12,1,354,-1,"The code has a small amount of lines of code and they seem intertwined.","It didn't help this time."
"037817b100",0,0,"N",2,1,2,"A",0,357,54,4,120.39,1,357,2,"The code is very lengthy and complex, trying to do many things at once.","The highlighted nodes helped majoritarily, but the other nodes also helped."
"037817b100",0,0,"N",2,1,2,"A",0,364,54,8,259.74,0,364,2,"Saying this class is lengthy is an absolute understatement. This class is so big and complex and full of methods and if statements that it is simply impossible to say that it couldn't be separated in many other classes.",""
"037817b100",0,0,"N",2,1,2,"A",0,368,54,6,102.81,0,368,2,"This method is too large, filled with if statements. It surely could be reduced.",""
"037817b100",0,0,"N",2,1,2,"A",0,370,54,15,46.8,0,370,-2,"This method doesn't even have a parameter list.",""
"037817b100",0,0,"N",2,1,2,"A",0,377,54,5,142.52,0,377,2,"The child class uses almost none of the parent class methods.",""
"037817b100",0,0,"N",2,1,2,"A",0,381,54,12,89.17,0,381,2,"This method has a huge list of parameters just to return the same method from de parent class passim the same parameters.",""
"037817b100",0,0,"N",2,1,2,"A",0,394,54,16,173.12,0,394,-1,"This class only has many instance variables, but is not centralizing processing or trying to do many things simultaneously.",""
"037667ebe6",2,2,"N",2,2,2,"A",2,315,55,3,2099.04,0,315,1,"The class has a lot of methods only for instance variables, format directories and include/exclude results in the scanned directories.",""
"037667ebe6",2,2,"N",2,2,2,"A",2,332,55,11,620.83,0,332,-1,"There are some variables in the code that are used only once, but since it's a class for tests, seems ok",""
"037667ebe6",2,2,"N",2,2,2,"A",2,344,55,13,320.29,0,344,-2,"The class has just the necessary methods and no extra variables. Everything fits with its responsibility.",""
"037667ebe6",2,2,"N",2,2,2,"A",2,374,55,7,893.37,0,374,2,"There's almost no use of any method of ConnectionFactoryProperties from child class",""
"037667ebe6",2,2,"N",2,2,2,"A",2,382,55,14,137.55,0,382,-2,"The code has a small method with no parameters list.",""
"037667ebe6",2,2,"N",2,2,2,"A",2,414,55,4,530.25,0,414,2,"There's a lot of conditions wrapped in functions, error messages mixed with logical code and everything seems messy.",""
"037667ebe6",2,2,"N",2,2,2,"A",2,444,55,8,620.46,1,444,2,"There's too much methods, some of them with a lot of switch cases, ifs and \"elses\" that are too big.","The metric about lines"
"037667ebe6",2,2,"N",2,2,2,"A",2,457,55,6,219.57,1,457,1,"The \"try\" block has some conditions chains that can make the code difficult to read.","The metric about the lines with source code"
"037667ebe6",2,2,"N",2,2,2,"A",2,469,55,15,215.89,1,469,1,"The method has some chained \"try/catch\" blocks.","The metrics give me some highlights about where I need to look to search for the smells."
"037667ebe6",2,2,"N",2,2,2,"A",2,485,55,5,3442.04,1,485,2,"The child class seems to use none of the methods of first class.","Depth of Inheritance Tree (DIT)"
"037667ebe6",2,2,"N",2,2,2,"A",2,486,55,12,451.39,1,486,1,"It's really a long parameter list, but since the method is small, don't look like a big deal.","Number of declarative Lines of Code and Declarative Statements"
"037667ebe6",2,2,"N",2,2,2,"A",2,487,55,16,81.34,1,487,-2,"All the methods are concise and the class serves for one responsibility only.","None"
