"f040190ed3",2,1,"N",2,2,2,"A",1,307,57,4,801.93,1,307,2,"Principalmente em relação ao número de linhas do código. Dessa forma, o código realiza muitas operações, deixando-o até um pouco complexo.","Número de linhas e Complexidade ciclomática"
"f040190ed3",2,1,"N",2,2,2,"A",1,320,57,7,472.49,1,320,2,"Principalmente a falta do uso de métodos da classe pai.","Não muito."
"f040190ed3",2,1,"N",2,2,2,"A",1,352,57,11,873.37,1,352,1,"Acredito que o problema em si, não seja o uso elevado de parâmetros e sim as declarações excessivas para os parâmetros recebidos, para instanciar outra classe.","não muito"
"f040190ed3",2,1,"N",2,2,2,"A",1,356,57,14,231.3,1,356,-2,"Não acredito que o método é muito longo e nem que tenta fazer muito.","não ajudou em nada, discordo da árvore."
"f040190ed3",2,1,"N",2,2,2,"A",1,365,57,3,266.05,1,365,2,"Uso elevado de instâncias.","Porcentagem de Falta de Coesão nos Métodos."
"f040190ed3",2,1,"N",2,2,2,"A",1,379,57,13,317.73,1,379,-2,"O código não implementa várias coisas, nem tende a ser complexo.","Discordo da árvore"
"f040190ed3",2,1,"N",2,2,2,"A",1,391,57,16,210.56,0,391,1,"Acredito que o código possui um número razoável de instâncias, no entanto não possui um grande número de responsabilidades diferentes.",""
"f040190ed3",2,1,"N",2,2,2,"A",1,399,57,8,102.36,0,399,2,"Possui um elevado número de responsabilidades, além disso, por ser muito longo torna o código bastante complexo.",""
"f040190ed3",2,1,"N",2,2,2,"A",1,411,57,6,263.16,0,411,-1,"Apesar de ter muitas linhas, possui comentários sucintos, facilitando a compreensão do código.",""
"f040190ed3",2,1,"N",2,2,2,"A",1,431,57,12,351.24,0,431,-1,"Possui um elevado número de parâmetros, no entanto, todos os parâmetros estão sendo usados.",""
"f040190ed3",2,1,"N",2,2,2,"A",1,443,57,5,274.12,0,443,2,"Apesar de herdar da classe pai, a classe filho não utiliza quase nenhum dos métodos do pai.",""
"f040190ed3",2,1,"N",2,2,2,"A",1,449,57,15,94.47,0,449,-2,"Não acredito que possui uma lista longa de parâmetros",""
"ee2546ee15",0,0,"N",0,0,0,"A",3,321,63,3,509.9,0,321,2,"Muito código, muitos métodos, muitas variáveis.",""
"ee2546ee15",0,0,"N",0,0,0,"A",3,325,63,14,172.54,0,325,-2,"Short and simple method.",""
"ee2546ee15",0,0,"N",0,0,0,"A",3,340,63,11,443,0,340,-1,"It has a lot of parameters but i think all of them are unavoidable.",""
"ee2546ee15",0,0,"N",0,0,0,"A",3,347,63,4,125.17,0,347,2,"Big method with a lot of decisions.",""
"ee2546ee15",0,0,"N",0,0,0,"A",3,351,63,13,107.72,0,351,-2,"Simple class with simple boolean methods.",""
"ee2546ee15",0,0,"N",0,0,0,"A",3,371,63,7,690.35,0,371,2,"It doesnt use  the methods and data of the parent.",""
"ee2546ee15",0,0,"N",0,0,0,"A",3,383,63,8,226.03,1,383,2,"Too much code.","Very useful way to identify godclasses."
"ee2546ee15",0,0,"N",0,0,0,"A",3,389,63,6,78.85,1,389,2,"Too much code.","Simple way to identify long methods."
"ee2546ee15",0,0,"N",0,0,0,"A",3,401,63,16,141.94,1,401,-2,"Few lines.","Super useful."
"ee2546ee15",0,0,"N",0,0,0,"A",3,438,63,5,754.51,1,438,-1,"The DIT is only 1.","Ive based my decision on the tree, very useful."
"ee2546ee15",0,0,"N",0,0,0,"A",3,452,63,12,252.29,1,452,-2,"It has less than 3 lines of declarative code.","Ive based my decision on the tree."
"ee2546ee15",0,0,"N",0,0,0,"A",3,463,63,15,250.22,1,463,-2,"The method has no parameters.","Very easy way to identify the smell."
"1c4dbe7e05",1,0,"N",2,2,1,"A",1,323,68,3,392.71,0,323,2,"Is too much complex, has too much line codes and variables.",""
"1c4dbe7e05",1,0,"N",2,2,1,"A",1,337,68,13,376.01,0,337,-1,"Its simple, only a few lines and straight to the point.",""
"1c4dbe7e05",1,0,"N",2,2,1,"A",1,355,68,4,328.1,0,355,2,"Has only one big method who does everything.",""
"1c4dbe7e05",1,0,"N",2,2,1,"A",1,380,68,7,728.36,0,380,2,"The child class has to use more methods and data of his parent class.",""
"1c4dbe7e05",1,0,"N",2,2,1,"A",1,386,68,14,94.23,0,386,-2,"The method go straight to the point.",""
"1c4dbe7e05",1,0,"N",2,2,1,"A",1,400,68,11,204.61,0,400,-1,"This method has a long list of parameters but its all used.",""
"1c4dbe7e05",1,0,"N",2,2,1,"A",1,422,68,12,408.38,1,422,-2,"All parameters are used.","The tree was a good help to find the answer."
"1c4dbe7e05",1,0,"N",2,2,1,"A",1,442,68,5,462.78,1,442,-2,"The DIT is only 1 and according to the tree it must be greater than 2 to be smelly.","The tree was essential to find the answer."
"1c4dbe7e05",1,0,"N",2,2,1,"A",1,467,68,16,417.49,1,467,-2,"According to the decision tree, a code isnt a GOD CLASS if has less than 612 line codes.","The decision tree helps me."
"1c4dbe7e05",1,0,"N",2,2,1,"A",1,470,68,8,110.04,1,470,2,"The code is a GOD CLASS because has more than 612 line codes.","The decision tree."
"1c4dbe7e05",1,0,"N",2,2,1,"A",1,472,68,15,106.04,1,472,2,"Has too much parameters, and some parameters are not used.","."
"1c4dbe7e05",1,0,"N",2,2,1,"A",1,474,68,6,186.61,1,474,1,"Has too many code lines, can be coded with less.","."
"aadeab9473",3,2,"B",3,2,2,"A",1,362,74,3,421.99,0,362,2,"Having a huge class increase immensely the difficulty in code maintenance and debbugin. \
\
if you have some sort of error in this class you would really have problems solving it because you would not know where it is",""
"aadeab9473",3,2,"B",3,2,2,"A",1,363,74,13,66.4,0,363,-2,"this class just evaluate values and return then.",""
"aadeab9473",3,2,"B",3,2,2,"A",1,369,74,4,146.35,0,369,2,"this class have a lot of if and else statements and tries to do too much",""
"aadeab9473",3,2,"B",3,2,2,"A",1,373,74,14,62.13,0,373,-2,"this method just evaluate a value",""
"aadeab9473",3,2,"B",3,2,2,"A",1,376,74,11,73.49,0,376,2,"int seeds, int depth, int threads, int maxPerHost, long topN could have been put inside an object",""
"aadeab9473",3,2,"B",3,2,2,"A",1,384,74,7,153.39,0,384,-1,",",""
"aadeab9473",3,2,"B",3,2,2,"A",1,397,74,8,158.94,1,397,2,"the class is big and trying to do too much","Percent Lack of Cohesion in Methods helped making my decision"
"aadeab9473",3,2,"B",3,2,2,"A",1,398,74,16,31.09,1,398,-2,"this class is fine.","Lines with Source Code helped with my decision"
"aadeab9473",3,2,"B",3,2,2,"A",1,405,74,6,137.57,1,405,-2,"the method is doing what it is supposed to do","Lines with Source Code and Comment to Code Ratio"
"aadeab9473",3,2,"B",3,2,2,"A",1,409,74,5,86.38,1,409,-1,",","."
"aadeab9473",3,2,"B",3,2,2,"A",1,415,74,15,68.72,1,415,-2,"Declarative Statements is not long","Declarative Statements"
"aadeab9473",3,2,"B",3,2,2,"A",1,417,74,12,39.27,1,417,2,"some of the paramether could have been passed as objects","Declarative Statements"
"1773411064",2,1,"B",2,0,1,"A",2,416,79,13,761.74,1,416,-2,"It says that the smell was classified as GOD CLASS, but I don't think that the class is doing several different things. The smell I would classified would be about comments, there is too much comments unecessaraly.","No. The first statement of the decision tree is set wrong, it says that the code doesn't have less than 612 lines of source code, but it does."
"1773411064",2,1,"B",2,0,1,"A",2,433,79,4,287.1,1,433,2,"The amount of switch statement to gather data from numerous classes with different interfaces.","The tree is right but it doesn't help me with the analysis."
"1773411064",2,1,"B",2,0,1,"A",2,448,79,7,351.79,1,448,2,"It also could be classified as a GOD CLASS.","The first statement says that the code has less than 265 physical lines, but it is not. Thus, the tree didn't help in this case."
"1773411064",2,1,"B",2,0,1,"A",2,460,79,14,216.15,1,460,-2,"This code has no smell.","The decision tree says that the code has less than 61 lines and the says that has less than 71. It is confusing, not helpful."
"1773411064",2,1,"B",2,0,1,"A",2,466,79,3,94.8,1,466,2,"Yes, the class is doing too much indeed.","Also, could say that there is A LOT of comments."
"1773411064",2,1,"B",2,0,1,"A",2,471,79,11,156.22,1,471,1,"The classification is right, but I can't see how we could reduce the number os parameters.","The tree is right and helpfull."
"1773411064",2,1,"B",2,0,1,"A",2,475,79,5,554.57,0,475,-1,"I would say the the java code should be classified as Duplicated Code. The part \"_log.trace(\"writeChar(\" + value + \")\");\"",""
"1773411064",2,1,"B",2,0,1,"A",2,476,79,15,67.33,0,476,2,"The number of try/catch could be condensed.",""
"1773411064",2,1,"B",2,0,1,"A",2,477,79,12,107.13,0,477,2,"blockSize and bufferSize could be only one parameter like size, and then specify the types of sizes.",""
"1773411064",2,1,"B",2,0,1,"A",2,478,79,6,48.6,0,478,2,"The method doing way too much.",""
"1773411064",2,1,"B",2,0,1,"A",2,479,79,16,135.34,0,479,2,"The class diverges with what it is doing.",""
"1773411064",2,1,"B",2,0,1,"A",2,480,79,8,73.78,0,480,2,"the class is way too complex, indeed.",""
"39a8d13e23",1,1,"B",2,3,2,"A",2,392,80,13,306.53,0,392,-2,"O código em questão não apresenta uma classe complexa, mas sim uma classe simples.",""
"39a8d13e23",1,1,"B",2,3,2,"A",2,406,80,4,261.21,0,406,2,"É realmente um 'Long Method', porque o método está muito grande.Contudo, esse código poderia ter sido dividido em mais métodos.Como por exemplo, um método específico para fazer as verificações.",""
"39a8d13e23",1,1,"B",2,3,2,"A",2,412,80,7,121.51,0,412,-2,"Não se verifica a redefinição de métodos.",""
"39a8d13e23",1,1,"B",2,3,2,"A",2,419,80,14,85.19,0,419,-2,"Não apresenta nenhuma das características mencionadas.",""
"39a8d13e23",1,1,"B",2,3,2,"A",2,423,80,3,92.58,0,423,2,"Código complexo, pelo fato de que apresenta uma grande extensão.",""
"39a8d13e23",1,1,"B",2,3,2,"A",2,428,80,11,70.15,0,428,2,"Apresenta,realmente, um vários parâmetros que poderiam ser condensados em uma classe, para evitar essa extensão dos parâmetros.",""
"39a8d13e23",1,1,"B",2,3,2,"A",2,441,80,5,312.68,1,441,-2,"Não apresenta o smell sugerido","Ajudou, já que fez com que pudesse ser visto a ausência das condições que a tornariam um smell."
"39a8d13e23",1,1,"B",2,3,2,"A",2,450,80,15,123.17,1,450,-2,"Não apresenta um longos parâmetros.","Não ajudou . pois não tinha relação com o smell citado."
"39a8d13e23",1,1,"B",2,3,2,"A",2,453,80,12,61.96,1,453,2,"Apresenta muitos parâmetros","Não ajudou, porque não tem relação com o smell citado."
"39a8d13e23",1,1,"B",2,3,2,"A",2,458,80,6,86.46,1,458,2,"Apresenta o smell citado","Não ajudou, porque não tinha relação com o smell citado."
"39a8d13e23",1,1,"B",2,3,2,"A",2,461,80,16,52.77,1,461,-2,"Não é uma god class","Não ajudou, porque não tinha relação com o smell."
"39a8d13e23",1,1,"B",2,3,2,"A",2,465,80,8,74.12,1,465,2,"Apresenta todas as condições que faz com que seja uma god class","Ajudou,porque as condições mostraram que realmente era uma god class"
