Node.java; org.apache.struts2.jasper.compiler; Validator.java; org.apache.struts2.jasper.compiler; 1->2;1068;  2->1;1Node.java; org.apache.struts2.jasper.compiler; Generator.java; org.apache.struts2.jasper.compiler; 1->2;1230;  2->1;10Node.java; org.apache.struts2.jasper.compiler; Parser.java; org.apache.struts2.jasper.compiler; 1->2;1205;  2->1;7ValueStack.java; org.apache.struts2.spi; Dispatcher.java; org.apache.struts2.dispatcher; 1->2;182;  2->1;0DoubleListUIBean.java; org.apache.struts2.components; AbstractDoubleListTag.java; org.apache.struts2.views.jsp.ui; 1->2;109;  2->1;68ValueStack.java; org.apache.struts2.spi; Jsr168Dispatcher.java; org.apache.struts2.portlet.dispatcher; 1->2;179;  2->1;0