next; HStoreScanner.java; src.java.org.apache.hadoop.hbase.regionserver; HStoreKey.java;23; next; StoreFileScanner.java; src.java.org.apache.hadoop.hbase.regionserver; HStoreKey.java;19; run; DemoClient.java; src.examples.thrift; RegionHistorian.java;17; mergeTwoRegions; Merge.java; src.java.org.apache.hadoop.hbase.util; HRegionInfo.java;16; getRecordWriter; IndexOutputFormat.java; src.java.org.apache.hadoop.hbase.mapred; IndexConfiguration.java;14; removeUnNeededCommitedTransactions; TransactionalRegion.java; src.java.org.apache.hadoop.hbase.regionserver.transactional; HLog.java;14; 